{
  "baseline_manifest_digest": "sha256:61bf5e1e571b64c015a1f9191ddffebb891d8db23ccaece5e8294c4fe90d34b5",
  "campaign_spec_digest": "sha256:d5501072559eba3eccbe1c932d7e026ff656125799564dc388e78d819e521866",
  "candidate_manifest_digest": "sha256:123a76672e6eb33b5eff195920784d78447b553caeb009e027b1373068565e7e",
  "created_at": "2026-01-01T00:00:00Z",
  "data_policy_digest": "sha256:f61fff0ff5941205fca8fc044c81e7a56aed9017539f6927ab9df0e81f70f88b",
  "draft_digest": "sha256:b77b073cd3c2e7a98c7d1ad3c87140885875c51d7f1439765592155d27911dbc",
  "draft_id": "draft_b77b073cd3c2e7a98c7d1ad3c8714088",
  "execution_plan_digest": "sha256:a51eb5e4e8e9e86abb51050d192266bbf54d8afdd454183fd2f4f17996aa4e0c",
  "executor_kind": "verifiers",
  "outcome_contract_digest": null,
  "policy_acknowledgement": {
    "acknowledged_at": "2026-01-01T00:00:00Z",
    "data_policy_digest": "sha256:f61fff0ff5941205fca8fc044c81e7a56aed9017539f6927ab9df0e81f70f88b",
    "method": "explicit_cli_review"
  },
  "program_ref": null,
  "public_context": {
    "climb_digest": "sha256:59e847f0e9539a8633cadbbd0ebe404de9e1236adc296ca276e2169d44d664c3",
    "kind": "climb"
  },
  "run_id": "run_bc5e01438ad71b7de1078aa4a307785a",
  "schema_version": "techtree.run-request.v2",
  "taskset_lock_digest": "sha256:6b9044be827c645e165347bf40d9fcb744c132eb8066c92bb5ed2834d6db5543"
}
